SNOMEDCTCodes,Description
85898001,Cardiomyopathy (disorder)
880040003,Arrhythmogenic left ventricular cardiomyopathy (disorder)
253528005,Arrhythmogenic right ventricular dysplasia (disorder)
715865008,Familial isolated arrhythmogenic right ventricular dysplasia (disorder)
715535009,Keratosis palmoplantaris and arrhythmogenic cardiomyopathy syndrome (disorder)
195029002,Cardiomyopathy associated with another disorder (disorder)
847041000000109,Amyloid cardiomyopathy (disorder)
1186866009,Cardiomyopathy due to acromegaly (disorder)
725416005,Cardiomyopathy due to cirrhosis of liver (disorder)
860837007,Cardiomyopathy due to connective tissue disease (disorder)
1264404009,Dilated cardiomyopathy due to scleroderma (disorder)
36471000,Dilated cardiomyopathy due to systemic lupus erythematosus (disorder)
35719004,Dilated cardiomyopathy due to systemic sclerosis (disorder)
788878000,Cardiomyopathy due to diabetes mellitus (disorder)
704241002,Fetal hypertrophic cardiomyopathy due to maternal diabetes mellitus (disorder)
1086051000119107,Cardiomyopathy due to diphtheria (disorder)
108701000119102,Cardiomyopathy due to hypertension (disorder)
471846004,Cardiomyopathy due to neuromuscular disorder (disorder)
860839005,Cardiomyopathy due to storage disease (disorder)
195027000,Cardiomyopathy due to mucopolysaccharidosis (disorder)
86995005,Dilated cardiomyopathy due to mucopolysaccharidosis (disorder)
84725008,Restrictive cardiomyopathy due to mucopolysaccharidosis (disorder)
60514000,Dilated cardiomyopathy due to familial storage disease (disorder)
58911001,Dilated cardiomyopathy due to glycogen storage disease (disorder)
880038008,Dilated cardiomyopathy due to lysosomal storage disease (disorder)
11104006,Dilated cardiomyopathy due to phytanic acid storage disease (disorder)
871638006,Hypertrophic cardiomyopathy due to glycogen storage disease (disorder)
1230303001,Fatal congenital hypertrophic cardiomyopathy due to glycogen storage disease (disorder)
1137377003,Cardiomyopathy due to thyrotoxicosis (disorder)
204981000119101,Cardiomyopathy due to viral infection (disorder)
119731000146105,Cardiomyopathy due to disease caused by severe acute respiratory syndrome coronavirus 2 (disorder)
30496006,Dilated cardiomyopathy due to viral myocarditis (disorder)
315608004,Cardiomyopathy in Duchenne muscular dystrophy (disorder)
195030007,Cardiomyopathy in Friedreich's ataxia (disorder)
50270004,Dilated cardiomyopathy due to Friedreich's ataxia (disorder)
890119003,Hypertrophic cardiomyopathy due to Friedreich ataxia (disorder)
195031006,Cardiomyopathy in myotonic dystrophy (disorder)
2816000,Dilated cardiomyopathy due to myotonic dystrophy (disorder)
50275009,Cobalt cardiomyopathy (disorder)
58629009,Dilated cardiomyopathy due to amyloidosis (disorder)
880014009,Dilated cardiomyopathy due to carnitine deficiency (disorder)
46696008,Dilated cardiomyopathy due to dermatomyositis (disorder)
39693003,Dilated cardiomyopathy due to granuloma (disorder)
86194008,Dilated cardiomyopathy due to infectious disease (disorder)
54830008,Dilated cardiomyopathy due to bacterial myocarditis (disorder)
44630002,Dilated cardiomyopathy due to fungal myocarditis (disorder)
1153452008,Dilated cardiomyopathy due to parasitic myocarditis (disorder)
40532006,Dilated cardiomyopathy due to protozoan myocarditis (disorder)
74249003,Dilated cardiomyopathy due to malignancy (disorder)
111285003,Dilated cardiomyopathy due to metabolic disorder (disorder)
1149109001,Dilated cardiomyopathy due to electrolyte imbalance (disorder)
8209004,Dilated cardiomyopathy due to hemochromatosis (disorder)
413995009,Dilated cardiomyopathy due to taurine deficiency (disorder)
28869005,Dilated cardiomyopathy due to muscular dystrophy (disorder)
79152002,Dilated cardiomyopathy due to neuromuscular disorder (disorder)
84733009,Dilated cardiomyopathy due to nutritional deficiency (disorder)
91604001,Dilated cardiomyopathy due to polyarteritis nodosa (disorder)
21430002,Dilated cardiomyopathy due to rheumatoid arthritis (disorder)
6022005,Dilated cardiomyopathy due to sarcoidosis (disorder)
472326004,Fetal hypertrophic cardiomyopathy associated with renal disease (disorder)
890122001,Hypertrophic cardiomyopathy due to disorder (disorder)
472325000,Fetal hypertrophic cardiomyopathy due to twin to twin transfusion syndrome (disorder)
890121008,Hypertrophic cardiomyopathy due to hyperthyroidism (disorder)
871649000,Hypertrophic cardiomyopathy due to lysosomal disease (disorder)
472316006,Hypertrophic mitochondrial cardiomyopathy (disorder)
890120009,Hypertrophic cardiomyopathy due to neuromuscular disorder (disorder)
775908005,Combined oxidative phosphorylation defect type 17 (disorder)
717812000,"Congenital cataract, hypertrophic cardiomyopathy, mitochondrial myopathy syndrome (disorder)"
763280005,"Encephalopathy, hypertrophic cardiomyopathy, renal tubular disease syndrome (disorder)"
1197430005,Glutaminyl-transfer ribonucleic acid amidotransferase subunit-related combined oxidative phosphorylation defect (disorder)
771509001,Hypertrophic cardiomyopathy and renal tubular disease due to mitochondrial deoxyribonucleic acid mutation (disorder)
718713000,Hypertrophic cardiomyopathy with hypotonia and lactic acidosis syndrome (disorder)
472318007,Hypertrophic mitochondrial cardiomyopathy associated with cataracts and lactic acidosis (disorder)
771513008,Infantile hypertrophic cardiomyopathy due to mitochondrial ribosomal protein L44 deficiency (disorder)
771478008,Mitochondrial hypertrophic cardiomyopathy with lactic acidosis due to mitochondrial transfer ribonucleic acid translation optimization 1 deficiency (disorder)
1186718008,"Neonatal encephalomyopathy, cardiomyopathy, respiratory distress syndrome (disorder)"
1177176009,Intermediate epidermolysis bullosa simplex with cardiomyopathy (disorder)
472100003,Ischemic dilated cardiomyopathy due to coronary artery disease (disorder)
46939000,Keshan disease (disorder)
472315005,Mitochondrial cardiomyopathy (disorder)
233875006,Post-myocarditic cardiomyopathy (disorder)
1173036000,Combined oxidative phosphorylation defect type 23 (disorder)
871639003,Dilated cardiomyopathy due to mitochondrial disease (disorder)
472319004,Fatal infantile mitochondrial cardiomyopathy (disorder)
472317002,Histiocytoid mitochondrial cardiomyopathy (disorder)
460500001,Histiocytoid mitochondrial cardiomyopathy due to cytochrome aa3 deficiency (disorder)
1172839002,"Lethal left ventricular non-compaction, seizures, hypotonia, cataract, developmental delay syndrome (disorder)"
1187635008,Maternally inherited mitochondrial cardiomyopathy (disorder)
472320005,Maternally inherited mitochondrial cardiomyopathy and myopathy (disorder)
789037005,Rheumatic cardiomyopathy (disorder)
471858004,Valvular cardiomyopathy (disorder)
415509000,Secondary restrictive cardiomyopathy (disorder)
79754008,Restrictive cardiomyopathy secondary to amyloidosis (disorder)
33006007,Restrictive cardiomyopathy secondary to endocardial fibroelastosis (disorder)
64615000,Restrictive cardiomyopathy secondary to glycogen storage disease (disorder)
76931005,Restrictive cardiomyopathy secondary to granulomas (disorder)
56941009,Restrictive cardiomyopathy secondary to hemochromatosis (disorder)
15544002,Restrictive cardiomyopathy secondary to infiltrations (disorder)
24584003,Restrictive cardiomyopathy secondary to malignancy (disorder)
39041004,Restrictive cardiomyopathy secondary to sarcoidosis (disorder)
415295002,Restrictive cardiomyopathy (disorder)
233878008,Familial restrictive cardiomyopathy (disorder)
715655000,Transthyretin related familial amyloid cardiomyopathy (disorder)
30884007,Restrictive cardiomyopathy secondary to familial storage disease (disorder)
90828009,Primary restrictive cardiomyopathy (disorder)
42099002,Primary endomyocardial fibrosis restrictive cardiomyopathy (disorder)
33258008,Primary eosinophilic endomyocardial restrictive cardiomyopathy (disorder)
64041007,Primary idiopathic restrictive cardiomyopathy (disorder)
233877003,Restrictive cardiomyopathy without endomyocardial fibrosis (disorder)
53703001,Primary eosinophilic endomyocardial cardiomyopathy (disorder)
398754006,Restrictive cardiomyopathy with endomyocardial fibrosis (disorder)
715626008,Tropical endomyocardial fibrosis (disorder)
713523008,Cardiomyopathy co-occurrent with human immunodeficiency virus infection (disorder)
399020009,Congestive cardiomyopathy (disorder)
720609003,Cardiomyopathy with cataract and hip spine disease syndrome (disorder)
233871002,Congestive obstructive cardiomyopathy (disorder)
165468981000119105,Toxic dilated cardiomyopathy (disorder)
72972005,Dilated cardiomyopathy caused by drug (disorder)
880042006,Dilated cardiomyopathy caused by anthracycline (disorder)
1234750000,Dilated cardiomyopathy caused by ethanol (disorder)
702424003,Dilated cardiomyopathy 3B (disorder)
64749001,Dilated cardiomyopathy due to infiltration (disorder)
719451006,Dilated cardiomyopathy with hypergonadotropic hypogonadism syndrome (disorder)
1179293006,Erythrokeratodermia cardiomyopathy syndrome (disorder)
766883006,Familial dilated cardiomyopathy with conduction defect due to lamin A/C mutation (disorder)
472327008,Fetal dilated cardiomyopathy (disorder)
719380003,Microcephalus cardiomyopathy syndrome (disorder)
111000119104,Nonischemic congestive cardiomyopathy (disorder)
413994008,Dilated cardiomyopathy with connective tissue disorder (disorder)
195021004,Primary dilated cardiomyopathy (disorder)
52029003,Primary familial dilated cardiomyopathy (disorder)
471890009,Dilated cardiomyopathy with genetic marker (disorder)
53043001,Primary idiopathic dilated cardiomyopathy (disorder)
699668009,Secondary nonischemic congestive cardiomyopathy (disorder)
12563008,Dilated cardiomyopathy caused by radiation (disorder)
723993005,Sensorineural deafness with dilated cardiomyopathy syndrome (disorder)
719839000,Tubular renal disease with cardiomyopathy syndrome (disorder)
719824001,Vici syndrome (disorder)
719835006,Wooly hair and palmoplantar keratoderma with dilated cardiomyopathy syndrome (disorder)
35728003,Familial cardiomyopathy (disorder)
27097002,Danish type familial amyloid cardiomyopathy (disorder)
83978005,Primary familial hypertrophic cardiomyopathy (disorder)
472323007,Fetal cardiomyopathy (disorder)
472324001,Fetal hypertrophic cardiomyopathy (disorder)
419097006,Glycogen storage disease due to lysosomal associated membrane protein 2 deficiency (disorder)
233873004,Hypertrophic cardiomyopathy (disorder)
720610008,Cardiomyopathy and renal anomaly syndrome (disorder)
1204194004,Hypertrophic cardiomyopathy of apex of heart (disorder)
45227007,Hypertrophic obstructive cardiomyopathy (disorder)
471885006,Hypertrophic cardiomyopathy with genetic marker (disorder)
195020003,Hypertrophic cardiomyopathy without obstruction (disorder)
724173009,Maternally inherited cardiomyopathy and hearing loss syndrome (disorder)
700065003,Primary hypertrophic cardiomyopathy (disorder)
63183009,Primary idiopathic hypertrophic cardiomyopathy (disorder)
719272007,Progressive sensorineural hearing loss and hypertrophic cardiomyopathy syndrome (disorder)
471841009,Inflammatory cardiomyopathy (disorder)
64077000,Myocardial degeneration (disorder)
195032004,Dystrophic cardiomyopathy (disorder)
871646007,Infiltrative cardiomyopathy (disorder)
69609002,Nonobstructive cardiomyopathy (disorder)
471870000,Pacing-induced cardiomyopathy (disorder)
774148007,Polyglucosan body myopathy type 1 (disorder)
62377009,Postpartum cardiomyopathy (disorder)
89461002,Primary cardiomyopathy (disorder)
68602002,Primary endomyocardial fibrosis cardiomyopathy (disorder)
240077004,Severe scapuloperoneal muscular dystrophy with cardiomyopathy (disorder)
426300009,Tachycardia-induced cardiomyopathy (disorder)
441541008,Takotsubo cardiomyopathy (disorder)
103331000119103,Toxic cardiomyopathy (disorder)
16228931000119102,Cardiomyopathy caused by drug (disorder)
471875005,Ventricular myocardial noncompaction cardiomyopathy (disorder)
447935001,Left ventricular myocardial noncompaction cardiomyopathy (disorder)
1187642008,"Macrocephaly, intellectual disability, left ventricular non compaction syndrome (disorder)"
426856002,Ischemic congestive cardiomyopathy (disorder)
702343002,Early onset myopathy with fatal cardiomyopathy (disorder)
1204192000,Aneurysm of apex of heart due to apical hypertrophic cardiomyopathy (disorder)
703259006,Mitral valve regurgitation due to cardiomyopathy (disorder)
15629741000119102,Systolic heart failure stage C due to ischemic cardiomyopathy (disorder)
15629641000119107,Systolic heart failure stage B due to ischemic cardiomyopathy (disorder)
15629541000119106,Congestive heart failure stage C due to ischemic cardiomyopathy (disorder)
703275009,Heart failure with reduced ejection fraction due to cardiomyopathy (disorder)
717821004,Glycogen storage disease with severe cardiomyopathy due to glycogenin deficiency (disorder)
440074009,Nonsurgical reduction of cardiac septum for hypertrophic obstructive cardiomyopathy with angiography of coronary artery (procedure)
