SNOMEDCTCodes,Description
74728003,Hypopituitarism (disorder)
237692001,Adrenocorticotropic hormone deficiency (disorder)
237693006,Idiopathic adrenocorticotropic hormone deficiency (disorder)
80599001,Isolated corticotropin deficiency (disorder)
773989002,Late-onset isolated adrenocorticotropic hormone deficiency (disorder)
702949005,Proopiomelanocortin deficiency syndrome (disorder)
237694000,Steroid suppression of adrenocorticotropic hormone secretion (disorder)
2851000119101,Anterior pituitary hormone deficiency (disorder)
721072003,"Short stature, pituitary and cerebellar defect and small sella turcica syndrome (disorder)"
718182008,Combined pituitary hormone deficiency genetic form (disorder)
773664005,"Deficiency in anterior pituitary function, variable immunodeficiency syndrome (disorder)"
397827003,Growth hormone deficiency (disorder)
421684006,Adult growth hormone deficiency (disorder)
421931005,Adult growth hormone deficiency with onset in childhood (disorder)
420351005,Adult-onset growth hormone deficiency (disorder)
724385009,Growth delay due to insulin-like growth factor type 1 deficiency (disorder)
429514007,Growth hormone deficiency after bone marrow transplant (disorder)
237689000,Growth hormone neurosecretory dysfunction (disorder)
237688008,Idiopathic growth hormone deficiency (disorder)
2109003,Isolated somatotropin deficiency (disorder)
18200000,Autosomal recessive isolated somatotropin deficiency (disorder)
7990002,Immunoglobulinemia with isolated somatotropin deficiency (disorder)
237687003,Isolated growth hormone deficiency - autosomal dominant (disorder)
38576000,Nonfamilial hyperinsulinemic isolated somatotropin deficiency (disorder)
17151000119108,Partial growth hormone deficiency (disorder)
237691008,Psychosocial growth hormone deficiency (disorder)
22306000,Transient somatotropin deficiency (disorder)
3072001,Hormone-induced hypopituitarism (disorder)
33927004,Hypogonadotropic hypogonadism (disorder)
62999006,Adiposogenital dystrophy (disorder)
715984007,Cerebellar ataxia with hypogonadism and choroidal dystrophy syndrome (disorder)
722944006,Congenital hypogonadotropic hypogonadism (disorder)
770941005,"Alopecia, progressive neurological defect, endocrinopathy syndrome (disorder)"
722380003,Congenital cataract with intellectual disability and hypogonadotropic hypogonadism syndrome (disorder)
782917007,Familial adrenal hypoplasia with absent pituitary luteinizing hormone (disorder)
722027009,Kallman syndrome with heart disease (disorder)
733113002,Hypogonadotropic hypogonadism retinitis pigmentosa syndrome (disorder)
721842008,Hypogonadotropic hypogonadism with frontoparietal alopecia syndrome (disorder)
773665006,"Hypogonadotropic hypogonadism, severe microcephaly, sensorineural hearing loss, dysmorphism syndrome (disorder)"
721846006,"Hypomyelination, hypogonadotropic hypogonadism, hypodontia syndrome (disorder)"
724281002,"Hyposmia, nasal and ocular hypoplasia, hypogonadotropic hypogonadism syndrome (disorder)"
764959000,"Intellectual disability, myopathy, short stature, endocrine defect syndrome (disorder)"
724174003,"Moebius syndrome, axonal neuropathy, hypogonadotropic hypogonadism syndrome (disorder)"
785722006,Obesity due to leptin receptor gene deficiency (disorder)
89392001,Prader-Willi syndrome (disorder)
770680004,Prader-Willi-like syndrome (disorder)
1003380001,6q16 microdeletion syndrome (disorder)
361117008,Female hypogonadotropic hypogonadism (disorder)
129633006,Induced female hypogonadism syndrome (disorder)
846680003,Functional hypogonadotropic hypogonadism (disorder)
421019006,Hypogonadotropic hypogonadism due to follicle-stimulating hormone deficiency (disorder)
420499009,Hypogonadotropic hypogonadism due to isolated gonadotropin deficiency (disorder)
93559003,Hypogonadism with anosmia (disorder)
421821002,Hypogonadotropic hypogonadism due to luteinizing hormone deficiency (disorder)
123953004,Idiopathic hypogonadotropic hypogonadism (disorder)
90182005,Hypophysectomy-induced hypopituitarism (disorder)
367411000119102,Hypopituitarism caused by drug (disorder)
237700006,Hypopituitarism due to iron overload (disorder)
40781006,Hypopituitarism due to pituitary tumor (disorder)
783008000,Pituitary dermoid and epidermoid cysts (disorder)
721288009,Hypopituitarism following procedure (disorder)
14900002,Radiotherapy-induced hypopituitarism (disorder)
237698002,Iatrogenic hypopituitarism (disorder)
267388009,Idiopathic hypopituitarism (disorder)
67873006,Isolated prolactin deficiency (disorder)
61701006,Lymphocytic hypopituitarism (disorder)
237707009,Lymphocytic hypophysitis of pregnancy (disorder)
14289006,Myopathy in hypopituitarism (disorder)
237697007,Oxytocin deficiency (disorder)
32390006,Panhypopituitarism (disorder)
190470005,Idiopathic panhypopituitarism (disorder)
771308008,"Non-acquired combined pituitary hormone deficiency, sensorineural hearing loss, spine abnormalities syndrome (disorder)"
237682009,Panhypopituitarism - anterior and posterior (disorder)
237683004,Panhypopituitarism - X-linked (disorder)
190471009,Post-birth injury panhypopituitarism (disorder)
190472002,Post-infarction panhypopituitarism (disorder)
123760002,Prepuberal panhypopituitarism (disorder)
237685006,Partial hypopituitarism (disorder)
89476005,Pituitary cachexia (disorder)
715668008,Pituitary deficiency due to empty sella turcica syndrome (disorder)
783009008,Pituitary deficiency due to Rathke cleft cysts (disorder)
267389001,Post-birth injury hypopituitarism (disorder)
271386001,Post-infective hypopituitarism (disorder)
237699005,Post-traumatic hypopituitarism (disorder)
267390005,Post-infarction hypopituitarism (disorder)
723999009,"Retinitis pigmentosa, hypopituitarism, nephronophthisis, skeletal dysplasia syndrome (disorder)"
442001,Secondary hypopituitarism (disorder)
82598004,Secondary hypothyroidism (disorder)
37429009,Hypothalamic hypothyroidism (disorder)
237695004,Idiopathic thyroid stimulating hormone deficiency (disorder)
89261000,Isolated thyrotropin deficiency (disorder)
276630006,Transient hypothyrotropinemia (disorder)
7611002,Septo-optic dysplasia sequence (disorder)
237684005,Sheehan's syndrome (disorder)
290653008,Postpartum hypopituitarism (disorder)
367460001,Pituitary dwarfism
237705001,Hypophysitis (disorder)
783243008,Adenohypophysitis (disorder)
237706000,Autoimmune hypophysitis (disorder)
237708004,Granulomatous giant-cell hypophysitis (disorder)
783158009,Infundibulo neurohypophysitis (disorder)
783016009,Panhypophysitis (disorder)
237701005,Pituitary apoplexy (disorder)
95830009,Pituitary infarction (disorder)
234533006,X-linked agammaglobulinemia with growth hormone deficiency (disorder)
71003000,Ateleiotic dwarfism (disorder)
27270004,Pituitary dwarfism with large sella turcica (disorder)
91187007,Pituitary dwarfism with small sella turcica (disorder)
51371005,Pituitary dwarfism with normal somatotropin level AND low somatomedin (disorder)
1186807002,Hereditary growth hormone deficiency (disorder)
783098009,Short stature due to partial growth hormone receptor deficiency (disorder)
766817004,Short stature due to growth hormone secretagogue receptor deficiency (disorder)
38196001,Laron-type isolated somatotropin defect (disorder)
